{
  "$schema": "http://json-schema.org/draft-07/schema#",
  "title": "sigma-ui.config.json",
  "type": "object",
  "properties": {
    "$schema": {
      "type": "string"
    },
    "styleSystem": {
      "type": "string",
      "enum": [
        "tailwind",
        "css"
      ],
      "description": "Install components styled with Tailwind utilities or with plain scoped CSS."
    },
    "framework": {
      "type": "string",
      "enum": [
        "vite",
        "nuxt",
        "laravel",
        "astro"
      ],
      "default": "vite"
    },
    "tsConfigPath": {
      "type": "string",
      "default": "tsconfig.json",
      "description": "tsconfig used to resolve path aliases."
    },
    "setupTailwind": {
      "type": "boolean",
      "default": false,
      "description": "Whether init set up Tailwind CSS for this project."
    },
    "cssPath": {
      "type": "string",
      "description": "Stylesheet that holds the theme variables, relative to the project root."
    },
    "baseColor": {
      "type": "string",
      "default": "grayscale",
      "description": "Theme base color."
    },
    "tailwind": {
      "type": "object",
      "properties": {
        "config": {
          "type": "string",
          "default": "",
          "description": "Optional legacy tailwind.config.js referenced with @config. Leave empty for CSS-first Tailwind v4."
        },
        "prefix": {
          "type": "string",
          "description": "Prefix added to Tailwind utility classes."
        }
      },
      "additionalProperties": false,
      "default": {}
    },
    "aliases": {
      "type": "object",
      "properties": {
        "components": {
          "type": "string",
          "description": "Import alias for UI components, e.g. @/components/ui."
        },
        "utils": {
          "type": "string",
          "default": "",
          "description": "Import alias for the cn() helper, e.g. @/lib/utils. Empty for the CSS style system."
        },
        "blocks": {
          "type": "string",
          "description": "Import alias for blocks. Defaults to a blocks folder next to the components folder."
        },
        "lib": {
          "type": "string",
          "description": "Import alias for registry:lib files. Defaults to the folder of utils."
        },
        "composables": {
          "type": "string",
          "description": "Import alias for composables. Defaults to <source root>/composables."
        }
      },
      "required": [
        "components"
      ],
      "additionalProperties": false
    },
    "generatePreflight": {
      "type": "boolean",
      "default": true,
      "description": "Write a preflight.css reset for the CSS style system."
    },
    "componentNaming": {
      "type": "string",
      "enum": [
        "pascal-case",
        "kebab-case"
      ],
      "default": "pascal-case",
      "description": "File naming for installed components. Directories are always kebab-case."
    },
    "registries": {
      "type": "object",
      "additionalProperties": {
        "anyOf": [
          {
            "type": "string",
            "description": "URL or path template for registry items. {name} is replaced with the item name and {style} with the style system. ${ENV_VAR} placeholders are expanded."
          },
          {
            "type": "object",
            "properties": {
              "url": {
                "type": "string",
                "description": "URL or path template for registry items. {name} is replaced with the item name and {style} with the style system. ${ENV_VAR} placeholders are expanded."
              },
              "params": {
                "type": "object",
                "additionalProperties": {
                  "type": "string"
                },
                "description": "Query parameters appended to the URL."
              },
              "headers": {
                "type": "object",
                "additionalProperties": {
                  "type": "string"
                },
                "description": "Request headers, e.g. Authorization: Bearer ${TOKEN}."
              }
            },
            "required": [
              "url"
            ],
            "additionalProperties": false
          }
        ]
      },
      "propertyNames": {
        "pattern": "^@[\\w-]+$"
      },
      "description": "Third-party registries, installed with sigma-ui add @namespace/item."
    }
  },
  "required": [
    "styleSystem",
    "cssPath",
    "aliases"
  ],
  "additionalProperties": false
}
